amb_data.csv

,Site,Depth,Niche,N,W,"Salinity, psu","Temperature ITS90, °C","Oxygen SBE43, µmol kg-1",Fluorescence,Nitrite (µmol kg-1),Nitrate (µmol kg-1),dFeT (nM),deCuT (nM)
SRR12425620,2,125,2,18.92,-108.79,34.7,13.3,4.9,0.1,0.04,25.91,1.22,1.2
SRR12425871,2,125,1,18.92,-108.79,34.7,13.3,4.9,0.1,0.04,25.91,1.22,1.2
SRR12426445,2,300,1,18.92,-108.79,34.66,10.38,1.97,0.1,0.04,29.25,1.55,1.13
SRR12426459,2,300,2,18.92,-108.79,34.66,10.38,1.97,0.1,0.04,29.25,1.55,1.13
SRR12426461,2,800,1,18.92,-108.79,34.52,5.27,3.35,0.1,0.01,43.83,NA,NA
SRR12426463,2,800,2,18.92,-108.79,34.52,5.27,3.35,0.1,0.01,43.83,NA,NA
SRR11786911,2,30,1,18.92,-108.79,34.62,23.57,218.04,0.14,0.01,0,0.23,0.93
SRR1509790,6,30,2,18.9,-104.89,34.57,24.95,188.95,1.81,0,0,0.88,1.14
SRR1509794,6,125,2,18.9,-104.89,34.79,12.92,1.4,0.12,3.92,22.76,NA,NA
SRR1509796,6,300,2,18.9,-104.89,34.76,10.75,1.91,0.1,2.27,27.19,1.58,1.02
SRR1509797,10,30,2,18.79,-104.67,34.7,25.9,208.9,0.24,NA,NA,0.17,1.05
SRR1509799,10,125,2,18.79,-104.67,34.79,13.36,1.84,0.15,5.12,21.05,1.26,0.93
SRR1509800,10,300,2,18.79,-104.67,34.75,10.63,1.89,0.1,2.38,25.54,1.1,0.9

README.md

### 1. Shotgun metagenomic datasets (NCBI_SRA)

* **NCBI BioProject [PRJNA632347](https://www.ncbi.nlm.nih.gov/bioproject/PRJNA632347):** Offshore Station 2 ($18.92^\circ\text{N}, 108.8^\circ\text{W}$).
  * Origin References: Ganesh et al. (2015) [https://doi.org/10.1038/ismej.2015.44](https://doi.org/10.1038/ismej.2015.44); Muratore et al. (2023) [https://doi.org/10.1128/msystems.01095-22](https://doi.org/10.1128/msystems.01095-22)[cite: 1].
* **NCBI BioProject [PRJNA254808](https://www.ncbi.nlm.nih.gov/bioproject/PRJNA254808):** Coastal Stations 6 ($18.9^\circ\text{N}, 104.5^\circ\text{W}$) and 10 ($18.8^\circ\text{N}, 104.7^\circ\text{W}$).
  * Origin Reference: Glass et al. (2015) [https://doi.org/10.3389/fmicb.2015.00998]