Data_metagen.csv

Bioproyect,ID access,Station,Depth (m),Filter (μm),Type_micro-niche,Platform,Read_Configuration,N,W
,,,,,,,,,
PRJNA632347,SRR12425620,2,125,0.22-1.6,VL,Illumina HiSeq 2000,paired-end 302bp,18.92,108.8
,SRR12425871,2,125,1.6-30 ,AP,Illumina HiSeq 2000,paired-end 302bp,18.92,108.8
,SRR12426445,2,300,1.6-30,AP,Illumina HiSeq 2000,paired-end 302bp,18.92,108.8
,SRR12426459,2,300,0.22-1.6,VL,Illumina HiSeq 2000,paired-end 302bp,18.92,108.8
,SRR12426461,2,800,1.6-30,AP,Illumina HiSeq 2000,paired-end 302bp,18.92,108.8
,SRR12426463,2,800,0.22-1.6,VL,Illumina HiSeq 2000,paired-end 302bp,18.92,108.8
,SRR11786911,2,30,1.6-30,AP,Illumina HiSeq 2000,paired-end 302bp,18.92,108.8
PRJNA254808,SRR1509790,6,30,0.22-1.6,VL,Illumina MiSeq,paired-end 478pb,18.9,104.5
,SRR1509794,6,125,0.22-1.6,VL,Illumina MiSeq,paired-end 400pb,18.9,104.5
,SRR1509796,6,300,0.22-1.6,VL,Illumina MiSeq,paired-end 379pd,18.9,104.5
,SRR1509797,10,30,0.22-1.6,VL,Illumina MiSeq,paired-end 479pd,18.8,104.7
,SRR1509799,10,125,0.22-1.6,VL,Illumina MiSeq,paired-end 479pd,18.8,104.7
,SRR1509800,10,300,0.22-1.6,VL,Illumina MiSeq,paired-end 476pd,18.8,104.7

README.md

### 1. Shotgun metagenomic datasets (NCBI_SRA)

* **NCBI BioProject [PRJNA632347](https://www.ncbi.nlm.nih.gov/bioproject/PRJNA632347):** Offshore Station 2 ($18.92^\circ\text{N}, 108.8^\circ\text{W}$).
  * Origin References: Ganesh et al. (2015) [https://doi.org/10.1038/ismej.2015.44](https://doi.org/10.1038/ismej.2015.44); Muratore et al. (2023) [https://doi.org/10.1128/msystems.01095-22](https://doi.org/10.1128/msystems.01095-22)[cite: 1].
* **NCBI BioProject [PRJNA254808](https://www.ncbi.nlm.nih.gov/bioproject/PRJNA254808):** Coastal Stations 6 ($18.9^\circ\text{N}, 104.5^\circ\text{W}$) and 10 ($18.8^\circ\text{N}, 104.7^\circ\text{W}$).
  * Origin Reference: Glass et al. (2015) [https://doi.org/10.3389/fmicb.2015.00998]